{"schema_name":"batch-record","schema_version":"1.0.0","kernel_version":"2.0.0","batch_id":"0123456789abcdef0123456789abcdef","batch_identity":{"kind":"bilibili_multipart","canonical_platform":"bilibili","batch_source_identity":"dddddddddddddddddddddddddddddddddddddddddddddddddddddddddddddddd","source_url":"https://www.bilibili.com/video/BV1Issue15001","original_title":"Issue 15 multipart batch","task_start":"2026-08-16T09:00:00+08:00","request_id":"issue-15-batch"},"output_root":"D:\\workspace","batch_dir":"D:\\workspace\\Issue 15 multipart batch_20260816_090000","control_dir":"D:\\workspace\\.workflow-control\\batches\\0123456789abcdef0123456789abcdef","batch_stage":"running","run_task_start":"2026-08-16T10:00:00+08:00","item_order":[{"item_index":1,"part_id":"p1","canonical_item_id":"BV1Issue15001","canonical_url":"https://www.bilibili.com/video/BV1Issue15001","title":"Part one","selected":true},{"item_index":2,"part_id":"p2","canonical_item_id":"BV1Issue15002","canonical_url":"https://www.bilibili.com/video/BV1Issue15002","title":"Part two","selected":true}],"run_mappings":[{"item_index":1,"run_id":"21e5b13e7ed63c7ed10e76fa62d5b66d","request_id":"0123456789abcdef0123456789abcdef:1"},{"item_index":2,"run_id":"f907ed1ef174d3c99ade158820d2b279","request_id":"0123456789abcdef0123456789abcdef:2"}],"projections":[{"item_index":1,"run_id":"21e5b13e7ed63c7ed10e76fa62d5b66d","projection_revision":1,"projection_sha256":"eeeeeeeeeeeeeeeeeeeeeeeeeeeeeeeeeeeeeeeeeeeeeeeeeeeeeeeeeeeeeeee","item_projection":{"schema_name":"batch-item-projection","schema_version":"1.0.0","kernel_version":"2.0.0","batch_id":"0123456789abcdef0123456789abcdef","item_index":1,"run_id":"21e5b13e7ed63c7ed10e76fa62d5b66d","run_state":{"phase":"source_ready","source_state":"ready","source_blocker":null,"coordination_revision":1,"output_path":"D:\\workspace\\Issue 15 multipart batch_20260816_090000\\work\\part1","delivery":{"stage":"delivered","ownership":{"session_id":"session-15","generation":1}}},"checkpoint":{"name":"source_ready","status":"current"},"blocker":null,"delivery_outcome":{"delivery_stage":"delivered","guarded_delivered":true,"acceptance_report_sha256":"aaaaaaaaaaaaaaaaaaaaaaaaaaaaaaaaaaaaaaaaaaaaaaaaaaaaaaaaaaaaaaaa","guard_report_sha256":"bbbbbbbbbbbbbbbbbbbbbbbbbbbbbbbbbbbbbbbbbbbbbbbbbbbbbbbbbbbbbbbb","delivered_at":"2026-08-16T10:00:00+08:00"},"projection_revision":1,"projected_at":"2026-08-16T10:05:00+08:00","source_authority":{"run_record_sha256":"cccccccccccccccccccccccccccccccccccccccccccccccccccccccccccccccc","guard_report_sha256":"bbbbbbbbbbbbbbbbbbbbbbbbbbbbbbbbbbbbbbbbbbbbbbbbbbbbbbbbbbbbbbbb","accepted_at_projection":"2026-08-16T10:04:00+08:00"}}}],"created_at":"2026-08-16T09:00:00+08:00","updated_at":"2026-08-16T10:05:00+08:00"}
